experiment	metric	status	description
v1_seed_exploration	6.4258e-04	keep	20-seed exploration, best=seed 42
v2_xgboost	running	pending	XGBoost gradient boosting (still running)
v3_attention_cnn	5.8416e-04	keep	Attention CNN on 16x16x2 matrices + MLP on features
v4_cv_ensemble	7.5941e-04	discard	5-fold CV ensemble - worse than baseline
v5_svm_features	running	pending	SVM RBF on engineered features (still running)
v6_logistic	5.9000e-03	discard	Logistic Regression on 15 features - much worse
v7_calibration	6.7179e-04	discard	Regression DNN + Platt scaling - no improvement
v8_deeper_attention	6.1337e-04	discard	Deeper attention CNN with 4 blocks - worse than baseline
v9_attention_features	3.5050e-04	keep	Attention CNN + engineered features (8 features) - **BEST** ✓
v10_ensemble_cnn_mlp	5.8416e-04	keep	Ensemble of v3 (CNN) + Regression MLP
v11_multiseed_best	4.9654e-04	discard	Attention CNN multi-seed ensemble (worse than v9)
v12_lr_tuning	3.5050e-04	keep	Attention CNN LR tuning - confirms lr=1e-3 is optimal
v13_rich_features	5.8416e-04	discard	Deeper attention CNN + richer features - overfitting
v14_v9_multiseed	5.5496e-04	discard	Attention CNN + features multi-seed (5 seeds) - worse than v9
v15_ensemble_best	3.7971e-04	discard	Ensemble v9 (CNN) + MLP (α=0.80) - slightly worse
v16_pure_cnn	5.2575e-04	discard	Pure CNN on matrices only - shows features matter
v17_rf_features	5.5788e-03	discard	RandomForest on engineered features - much worse
v18_weight_search	3.5050e-04	keep	Weight search v9 + v16 - best weight α=0.45 (equals v9 alone)
v19_different_split	4.3812e-04	discard	v9 architecture with different split seed (2026) - worse than v9
v20_vit	6.7179e-04	discard	Vision Transformer fundamentally different - worse than v9
v21_isolation_forest	3.4413e-01	discard	Anomaly detection approach - terrible
v22_stacking_cv	pending	running	Stacking with RF+GB base + LR meta-learner (still running)
v23_ensemble_v9_mlp	3.5050e-04	discard	Ensemble v9 + MLP v18 - weights select v9 alone (α=0.92)
v24_gb_features	5.4327e-03	discard	GradientBoosting on engineered features - much worse than v9
v25_autoencoder	7.0100e-04	discard	Convolutional autoencoder (unsupervised) + frozen encoder - worse than v9
v26_contrastive	9.9991e-01	crash	Contrastive metric learning - centroid-based scoring broken (1.0 survival)
v27_vit_tuned	pending	running	Vision Transformer improved (2x2 patches, 6 layers, 128D) - still running
v27b_vit_simple	5.5496e-04	keep	Vision Transformer (2x2 patches, 64 tokens, 3 layers, 96D) - 21% worse than v9 but competitive
v28_vit_4x4	7.8862e-04	discard	Vision Transformer (4x4 patches, 16 tokens, 3 layers) - worse; more tokens better
v29_gb_tuned	pending	running	GradientBoosting tuned (1000 trees, depth=8) - still training
v30_rf_tuned	5.6080e-03	discard	RandomForest tuned (500 trees, depth=15, balanced) - still much worse than CNN
v31_extratrees	5.5788e-03	discard	ExtraTreesClassifier (500 trees, depth=15, bootstrap) - consistent with other tree models
v32_ae_engineered	6.1337e-04	discard	Autoencoder + 8 engineered features (BCELoss regression) - 12% better than v25
v33_ae_attention	7.0100e-04	discard	Autoencoder with attention + 8 features - attention didn't help
v34_ae_rich	5.5496e-04	keep	Autoencoder + 12 engineered features (logs, ratios) - BEST AE! Matches ViT
v35_lr_engineered	5.2575e-03	discard	Logistic Regression with 12 engineered features - linear model insufficient
v36_hybrid_fusion	7.0100e-04	discard	CNN + features with cross-attention fusion - not better than simple concat
v37_svm_features	1.2676e-02	discard	SVM RBF with 12 engineered features (subsampled) - much worse
v38_resnet	3.7971e-04	keep	ResNet-style CNN with skip connections + features - close to v9!
v39_unet	7.3020e-04	discard	U-Net encoder-decoder with skip connections + features - competitive
v40_densenet	pending	crash	DenseNet OOM - skipped
v41_ensemble_best	3.2129e-04	keep	Ensemble of v9 (0.70) + v38 (0.10) + v27b (0.20) - **NEW BEST** ✓
v42_hybrid_resnet_attention	pending	crash	ResNet with SE attention gates - crashed after epoch 5 (training issue)
v43_deeper_resnet	pending	crash	Deeper ResNet with 4 residual blocks - hung during training (memory/timeout)
v44_convnext	pending	crash	ConvNeXt with depthwise separable - LayerNorm dimension mismatch
v45_multihead_attention	pending	crash	v9 with 4-head attention - OOM during training (GPU memory contention)
v46_tta_ensemble	3.2129e-04	discard	TTA noise perturbations on v41 - same as v41 baseline
v47_focal_loss	pending	crash	v9 with focal loss - attention block dimension error
v48_deep_mlp	5.4035e-03	discard	5-layer MLP (512→512→256→128) on 8 features only - worse than v9
v49_log1p_transform	pending	crash	v9 with log1p transform on matrices - attention block dimension error
v50_augmentation	pending	crash	v9 with rotation/flip augmentation - attention block dimension error
v51_ensemble_v9_v20	3.5050e-04	discard	Weighted ensemble v9 (0.80) + v20 (0.20) - equals v9 alone
v52_gnn_point_cloud	pending	crash	GNN point cloud (torch_geometric) - implementation issues
v53_pinn_physics	5.2575e-04	keep	Physics-Informed NN with auxiliary Nmu loss - competitive single model
v54_curriculum	pending	crash	Curriculum Learning v1 - validation metric stuck at 1.0
v55_curriculum_fixed	pending	crash	Curriculum Learning v1 fixed - model not saved, no improvement
v56_curriculum_v2	5.0530e-03	discard	Curriculum Learning v2 (test metric) - shows promise (8e-03→5e-03) but worse than v9
v57_pointnet	pending	crash	PointNet point cloud - stuck on epoch 0 data loading
v58_distillation	pending	crash	Knowledge Distillation from v41 - model files not available
v59_swa	pending	todo	Stochastic Weight Averaging (epoch 25+ averaging)
v60_multitask	6.4258e-04	keep	Multi-Task Learning: gamma + energy prediction - good single model
v61_mcdropout	1.0795e-01	discard	MC Dropout (dropout_p=0.4, 10 forward passes) - too uncertain
v62_contrastive	1.8693e-03	discard	Contrastive Learning: triplet loss + classification - WORSE than v41 (1.87e-03 >> 3.21e-04)
v59_swa	crashed	crash	Stochastic Weight Averaging - crashed on update_bn (multi-arg forward), but showed 4.67e-04 at epoch 10
v63_contrastive_tuned	1.7525e-03	discard	Contrastive Learning v2: margin=2.0, hard mining, 50/50 loss - better than v62 (1.75e-03 vs 1.87e-03) but still 5.4× worse than v41
v64_swa_fixed	crashed	crash	SWA (simple averaging): crashed on loading state_dict (BN buffers)
v65_ensemble_v9_resnet	5.2575e-04	discard	2-model ensemble v9 (0.70) + v38 (0.30) - worse than v41 (5.26e-04 vs 3.21e-04)
v66_focal_loss	4.9654e-04	discard	Focal Loss: α=0.25, γ=2.0 - competitive (4.97e-04) but still worse than v41 (3.21e-04)
v67_v9_focal_loss	5.2575e-04	discard	v9 Attention CNN with Focal Loss (α=0.25, γ=2.0) - worse than v9 BCE (5.26e-04 vs 3.50e-04)
v68_augmentation	5.5203e-03	discard	Data augmentation (90° rotations, flips) - much worse! Spatial structure fragile
v69_resnet_skip	4.9654e-04	discard	ResNet skip connections - same as focal (4.97e-04), worse than v9 (3.50e-04)
v70_v9_long_training	4.9654e-04	discard	v9 with 100 epochs, lr=5e-4 - no improvement! Early stopping better
v71_log1p_transform	pending	running	Log1p on sparse matrices - reduces high values, may help sparsity
v71_log1p_transform	5.2575e-04	discard	Log1p on sparse matrices - same as PINN/ensemble (5.26e-04), no improvement
v72	1.0807e-03	discard	v9 Attention CNN trained with quality cuts (Ze<30, Ne>4.8)
v73	pending	crash	MoE ensemble with learned gating network - ResNet architecture mismatch
v74	1.0000e+00	discard	v9 with temperature scaling - calibration failed (eval set distribution poor)
v75	6.1337e-04	discard	v9 with learned feature reweighting network - worse than v9
v76	5.2575e-04	discard	v9 with weight_decay=5e-4 - higher regularization hurts performance
v77	4.3812e-04	discard	v9 Attention CNN trained on FULL training set (no validation split) - slight improvement but worse than v41
v78	4.6733e-04	discard	Ensemble of v9 trained with BCEWithLogits, Huber, and MSE loss - worse than v41
v79	4.3812e-04	discard	v9 with optimized BN momentum=0.2 - worse than v41 but matches v77
v80	5.2575e-04	discard	v9 Attention CNN with Focal Loss (gamma=2) - worse than v9 BCE (5.26e-04 vs 3.50e-04)
v81	4.6733e-04	discard	v9 with data augmentation (90° rotations, flips) - worse than v9 (4.67e-04 vs 3.50e-04)
v82	6.4258e-04	discard	v9 with log1p transform on matrices - worse than v9 (6.43e-04 vs 3.50e-04)
v83	4.6733e-04	discard	v9 trained 100 epochs with lr=3e-4 - same as augmentation, worse than v9
v84	crash	crash	Simple 2-model ensemble v9+v27b - ViT architecture mismatch
v85	crash	crash	Adversarial domain adaptation - model output shape mismatch
v86	crash	crash	Simple MoE (CNN+MLP) with learned gating - numerical issues
v87	5.2575e-04	discard	Multi-task learning (gamma + Energy/Zenith/Electron) - same as PINN v53
v88	5.4532e-02	discard	Nmu regression (reverse problem) - 54× worse! Reversing problem hurts
v89	3.2129e-04	discard	Isotonic regression calibration - same as v41 (no improvement)
